root@comp3134Winter2024:~# tcpdump -n -i eth0
tcpdump: verbose output suppressed, use -v[v]... for full protocol decode
listening on eth0, link-type EN10MB (Ethernet), snapshot length 262144 bytes
22:27:27.509306 IP 143.198.38.131.22 > 198.96.84.204.50860: Flags [P.], seq 958414712:958414820, ack 1194315996, win 501, length 108
22:27:27.509406 IP 143.198.38.131.22 > 198.96.84.204.50860: Flags [P.], seq 108:264, ack 1, win 501, length 156
22:27:27.509471 IP 143.198.38.131.22 > 198.96.84.204.50860: Flags [P.], seq 264:332, ack 1, win 501, length 68
22:27:27.509542 IP 143.198.38.131.22 > 198.96.84.204.50860: Flags [P.], seq 332:368, ack 1, win 501, length 36
22:27:27.515795 IP 198.96.84.204.50860 > 143.198.38.131.22: Flags [.], ack 108, win 510, length 0
22:27:27.515843 IP 198.96.84.204.50860 > 143.198.38.131.22: Flags [.], ack 332, win 509, length 0
22:27:27.564885 IP 198.96.84.204.50860 > 143.198.38.131.22: Flags [.], ack 368, win 509, length 0
22:27:27.609279 IP 143.198.38.131.22 > 198.96.84.204.50860: Flags [P.], seq 368:540, ack 1, win 501, length 172
22:27:27.609396 IP 143.198.38.131.22 > 198.96.84.204.50860: Flags [P.], seq 540:724, ack 1, win 501, length 184
22:27:27.609469 IP 143.198.38.131.22 > 198.96.84.204.50860: Flags [P.], seq 724:760, ack 1, win 501, length 36
22:27:27.609527 IP 143.198.38.131.22 > 198.96.84.204.50860: Flags [P.], seq 760:908, ack 1, win 501, length 148
22:27:27.609609 IP 143.198.38.131.22 > 198.96.84.204.50860: Flags [P.], seq 908:1092, ack 1, win 501, length 184
22:27:27.609678 IP 143.198.38.131.22 > 198.96.84.204.50860: Flags [P.], seq 1092:1128, ack 1, win 501, length 36
22:27:27.609845 IP 143.198.38.131.22 > 198.96.84.204.50860: Flags [P.], seq 1128:1428, ack 1, win 501, length 300
22:27:27.609893 IP 143.198.38.131.22 > 198.96.84.204.50860: Flags [P.], seq 1428:1464, ack 1, win 501, length 36
22:27:27.609964 IP 143.198.38.131.22 > 198.96.84.204.50860: Flags [P.], seq 1464:1596, ack 1, win 501, length 132
22:27:27.610029 IP 143.198.38.131.22 > 198.96.84.204.50860: Flags [P.], seq 1596:1632, ack 1, win 501, length 36
